### ISSUE TITLE
Tarantool saves extra 8 bytes in datetime field getting zero nanosecond from iproto

### ISSUE THREAD

**Issue by ArtDu** [tarantool/tarantool#8932]
If a connector doesn't validate optional params and passes 0 nanoseconds into space by iproto space operations tarantool will store unnecessary extra bytes. The interesting part is if we use CALL/EVAL extra bytes will be omitted.

I don't know if tarantool should check this or not. Or it is the responsibility of the connector only. It's similar to this problem https://github.com/tarantool/tarantool/issues/8905

Tarantool Enterprise 2.11.0-0-gc9673ebb7-r563-gc64

**Steps to reproduce**

I used tcpdump for clarity

<details><summary>send_raw_iproto_via_netbox.lua</summary>
<p>

```lua
msgpack = require'msgpack'
datetime = require'datetime'

conn = require('net.box').connect('localhost:3301')

IPROTO_REQUEST_TYPE = 0x00
IPROTO_SYNC = 0x01
IPROTO_SPACE_ID = 0x10
IPROTO_TUPLE = 0x21
IPROTO_FUNCTION_NAME = 0x22
IPROTO_EXPR = 0x27

IPROTO_REPLACE = 0x03
IPROTO_CALL = 0x0a
IPROTO_EVAL = 0x08

function inject_eval(conn, raw_val, expr)
    expr = expr or 'return ...'
    local header = msgpack.encode({
        [IPROTO_REQUEST_TYPE] = IPROTO_EVAL,
        [IPROTO_SYNC] = conn:_next_sync(),
    })
    local body = msgpack.encode({
        [IPROTO_EXPR] = expr,
        -- Reserve a slot for raw_val.
        [IPROTO_TUPLE] = {box.NULL},
    })

    -- Replace the nil placeholder with val
    body = string.sub(body, 1, 3) .. raw_val .. string.sub(body, 5)
    local size = msgpack.encode(#header + #body)
    local request = size..header..body

    return conn:_inject(request)
end

function inject_replace(conn, raw_val, space_id)
    space_id = space_id or 512
    local header = msgpack.encode({
        [IPROTO_REQUEST_TYPE] = IPROTO_REPLACE,
        [IPROTO_SYNC] = conn:_next_sync(),
    })
    local body = msgpack.encode({
        [IPROTO_SPACE_ID] = space_id,
        -- Reserve a slot for raw_val.
        [IPROTO_TUPLE] = {box.NULL},
    })

    -- Replace the nil placeholder with val
    body = string.sub(body, 1, 2) .. raw_val .. string.sub(body, 5)
    local size = msgpack.encode(#header + #body)
    local request = size..header..body

    return conn:_inject(request)
end

-- for checking
tohex = function(s) return (s:gsub('.', function(c) return string.format('%02X ', string.byte(c)) end)) end
tohex(msgpack.encode('1')) -- 'A1 31'

inject_eval(conn, string.fromhex('a131')) -- ['1'] - equals to 'return 1'

```

</p>
</details> 

Pass datetime with fixed year(31) and nsec(0)
```lua
tarantool> inject_replace(conn, string.fromhex('9201d804804cdbc0f1ffffff0000000000000000'))
---
- [[1, '0031-01-01T00:00:00Z']]
...
```

In tcpdump we can see that we pass tuple with 16 bytes datetime and tarantool save tuple and return it back
<pre>
15:09:38.247311 IP6 (flowlabel 0xe0f00, hlim 64, next-header TCP (6) payload length: 64) localhost.54110 > localhost.3301: Flags [P.], cksum 0x0048 (incorrect -> 0x83c9), seq 345:377, ack 752, win 6014, options [nop,nop,TS val 391808195 ecr 1409520179], length 32: IPROTO size=31 request: REPLACE, SYNC: 40
TUPLE: [1, <b>(Datetime extension: len 16)</b>]
SPACE_ID: 512
15:09:38.247457 IP6 (flowlabel 0x40300, hlim 64, next-header TCP (6) payload length: 32) localhost.3301 > localhost.54110: Flags [.], cksum 0x0028 (incorrect -> 0xc2af), ack 377, win 6351, options [nop,nop,TS val 1409531827 ecr 391808195], length 0
15:09:38.247617 IP6 (flowlabel 0x40300, hlim 64, next-header TCP (6) payload length: 87) localhost.3301 > localhost.54110: Flags [P.], cksum 0x005f (incorrect -> 0x461c), seq 752:807, ack 377, win 6351, options [nop,nop,TS val 1409531827 ecr 391808195], length 55: IPROTO size=50 response: OK, SYNC: 40, SCHEMA_VERSION: 84
DATA:
[1, <b>(Datetime extension: len 16)</b>]
15:09:38.247630 IP6 (flowlabel 0xe0f00, hlim 64, next-header TCP (6) payload length: 32) localhost.54110 > localhost.3301: Flags [.], cksum 0x0028 (incorrect -> 0xc3ca), ack 807, win 6013, options [nop,nop,TS val 391808195 ecr 1409531827], length 0
</pre>

If we pass it into lua 0 nsec will be omitted

```lua
tarantool> inject_eval(conn, string.fromhex('d804804cdbc0f1ffffff0000000000000000'), 'return box.space.tmp:replace({1, ...})')
---
- [[1, '0031-01-01T00:00:00Z']]
...
```

<pre>
15:14:05.244371 IP6 (flowlabel 0xe0f00, hlim 64, next-header TCP (6) payload length: 100) localhost.54110 > localhost.3301: Flags [P.], cksum 0x006c (incorrect -> 0x5127), seq 377:445, ack 807, win 6013, options [nop,nop,TS val 392075188 ecr 1409531827], length 68: IPROTO size=67 request: EVAL, SYNC: 41
TUPLE: [<b>(Datetime extension: len 16)</b>]
EXPR: return box.space.tmp:replace({1, ...})
15:14:05.244471 IP6 (flowlabel 0x40300, hlim 64, next-header TCP (6) payload length: 32) localhost.3301 > localhost.54110: Flags [.], cksum 0x0028 (incorrect -> 0x9c4b), ack 445, win 6350, options [nop,nop,TS val 1409798820 ecr 392075188], length 0
15:14:05.254261 IP6 (flowlabel 0x40300, hlim 64, next-header TCP (6) payload length: 79) localhost.3301 > localhost.54110: Flags [P.], cksum 0x0057 (incorrect -> 0x27b6), seq 807:854, ack 445, win 6350, options [nop,nop,TS val 1409798830 ecr 392075188], length 47: IPROTO size=42 response: OK, SYNC: 41, SCHEMA_VERSION: 84
DATA:
[1, <b>(Datetime extension: len 8)</b>]
15:14:05.254279 IP6 (flowlabel 0xe0f00, hlim 64, next-header TCP (6) payload length: 32) localhost.54110 > localhost.3301: Flags [.], cksum 0x0028 (incorrect -> 0x9d5a), ack 854, win 6012, options [nop,nop,TS val 392075198 ecr 1409798830], length 0
</pre>

**Comment by alyapunov** [comment]
If I understood correctly, Tarantool does not repack incoming data although it could save memory.
Actually it is a feature. Tarantool almost always stores incoming msgpack exactly as user sends it. For example if you insert a tuple with 9 byte unsigned zero (0xcf 0x00 0x00 0x00 0x00 0x00 0x00 0x00 0x00), the following select will return exactly the same  9 byte unsigned zero in result. The reason is that a user can know what he want and tarantool should not interfere.
Feel free to provide more details and reopen.
